{
  "schema_version": 1,
  "slug": "zden-haluska-halv-312ksats",
  "title": "Zden Level HALV",
  "tier": "mid",
  "status": "open",
  "dead_end_reason": null,
  "series": "Zden's crypto.haluska.sk puzzle series",
  "author": {
    "name": "Zden (Zdenek Haluska)",
    "handles": [
      "x:@Zd3N"
    ],
    "url": "https://crypto.haluska.sk/"
  },
  "published": {
    "date": "2024-04-20",
    "url": "https://twitter.com/Zd3N/status/1781475361160663236"
  },
  "chain": "bitcoin",
  "prize": {
    "amount": 312500,
    "asset": "sats",
    "usd_estimate": 252,
    "usd_snapshot": "2026-10-24",
    "note": ""
  },
  "addresses": [
    {
      "address": "1crypto24HCr178iMcKd5iUi5D4rsg1nK",
      "chain": "bitcoin",
      "role": "escrow",
      "label": "main",
      "explorer": "https://mempool.space/address/1crypto24HCr178iMcKd5iUi5D4rsg1nK",
      "expected": "312500 sats",
      "verified_on": "2026-10-24",
      "verified_state": "funded-unspent"
    }
  ],
  "puzzle_type": [
    "geometry",
    "raw-private-key"
  ],
  "target_format": "256-bit private key as direct hex, P2PKH",
  "derivation": {
    "summary": "read the shape (circle or diamond) of each of 59 waveform lobes and any other channel needed, turn that reading into a 256-bit private key, derive P2PKH and compare to the escrow",
    "oracle": "tools/oracle.py",
    "oracle_certified": true,
    "certified_against": "a standard public vector, private key 1 (the generator point); the puzzle's own waveform reading is not itself certified"
  },
  "difficulty_left": "external-info",
  "difficulty_note": "the waveform geometry is stably measured across 3 independent passes; the measured information capacity of the image (about 118 bits) falls short of the 256 bits a private key needs, and no hint has been published for this specific puzzle, unlike every other long-open puzzle in the same series",
  "tested_total": {
    "candidates": 500000400,
    "families": 5,
    "certified": false
  },
  "leads": [
    {
      "rank": 1,
      "title": "a hint published by the author (none exists yet for this puzzle)",
      "cost": "needs a person",
      "status": "open"
    },
    {
      "rank": 2,
      "title": "certify the oracle with a known-good vector",
      "cost": "minutes, already done in this folder",
      "status": "open"
    }
  ],
  "solutions": [],
  "artifacts": [
    {
      "path": "clues/cryptoHALV.png",
      "sha256": "3a487ebaeb4801137f09159a2d533046936cd395f4e2f7d115ac554607790e95",
      "source": "https://crypto.haluska.sk/",
      "archived": null
    }
  ],
  "sources": [
    {
      "title": "Zden, original announcement",
      "url": "https://twitter.com/Zd3N/status/1781475361160663236",
      "date": "2024-04-20",
      "archived": null
    },
    {
      "title": "Zden's puzzle site",
      "url": "https://crypto.haluska.sk/",
      "date": "2026-08-16",
      "archived": null
    }
  ],
  "third_party_material": "",
  "last_updated": "2026-10-24"
}
