{
  "schema_version": 1,
  "slug": "wealth-in-poetry-0-03btc",
  "title": "Trithemius: Wealth in Poetry",
  "tier": "mid",
  "status": "open",
  "dead_end_reason": null,
  "series": null,
  "author": {
    "name": "Trithemius (pseudonym)",
    "handles": [],
    "url": "https://medium.com/coinmonks/securing-bitcoin-seed-phrases-in-stories-d8eb43a02254"
  },
  "published": {
    "date": "2019-02-11",
    "url": "https://medium.com/coinmonks/securing-bitcoin-seed-phrases-in-stories-d8eb43a02254"
  },
  "chain": "bitcoin",
  "prize": {
    "amount": 3124630,
    "asset": "sats",
    "usd_estimate": 2524,
    "usd_snapshot": "2026-10-24",
    "note": "0.0312463 BTC, 2 funding transactions, exact dates not recorded"
  },
  "addresses": [
    {
      "address": "1K4ezpLybootYF23TM4a8Y4NyP7auysnRo",
      "chain": "bitcoin",
      "role": "escrow",
      "label": "main",
      "explorer": "https://mempool.space/address/1K4ezpLybootYF23TM4a8Y4NyP7auysnRo",
      "expected": "3124630 sats",
      "verified_on": "2026-10-24",
      "verified_state": "funded-unspent"
    }
  ],
  "puzzle_type": [
    "bip39-seed",
    "text-cipher",
    "brainwallet"
  ],
  "target_format": "BIP39 12 words, position selected by an author-specific numeric key applied to the article text; passphrase and derivation path not confirmed",
  "derivation": {
    "summary": "tokenize the article text, apply an unknown author-specific numeric key to select 12 word positions, then derive BIP44/49/84 or a raw BIP32 path and compare to the escrow address",
    "oracle": null,
    "oracle_certified": false,
    "certified_against": ""
  },
  "difficulty_left": "insight",
  "difficulty_note": "the mechanism is taught explicitly by the author; tokenization is calibrated against both worked examples; the real carrier text and numeric key are, by the article's own design, author-specific and not guessable from the article alone, consistent with a stylometric pass finding no detectable insertion fingerprint",
  "tested_total": {
    "candidates": 878000,
    "families": 8,
    "certified": false
  },
  "leads": [
    {
      "rank": 1,
      "title": "read the cipher table on the embedded Steganographia photo",
      "cost": "hours",
      "status": "open"
    },
    {
      "rank": 2,
      "title": "rule out an old-Electrum (non-BIP39) wallet",
      "cost": "hours",
      "status": "open"
    },
    {
      "rank": 3,
      "title": "build a certified acceptance test for the derivation code",
      "cost": "minutes",
      "status": "open"
    }
  ],
  "solutions": [],
  "artifacts": [],
  "sources": [
    {
      "title": "Trithemius, Securing Bitcoin Seed Phrases in Stories, Medium/Coinmonks",
      "url": "https://medium.com/coinmonks/securing-bitcoin-seed-phrases-in-stories-d8eb43a02254",
      "date": "2019-02-11",
      "archived": null
    },
    {
      "title": "Community tracker confirming the puzzle is unsolved",
      "url": "https://privatekeys.pw/puzzles/0.03-btc-coinmonks-puzzle",
      "date": "2026-08-16",
      "archived": null
    }
  ],
  "third_party_material": "the narrative text was written and published by the puzzle author himself as the vehicle for the puzzle; short excerpts are quoted in clues/author-posts.md; the embedded stock photography is third-party licensed illustration, referenced but not reproduced here",
  "last_updated": "2026-10-24"
}
